{
  "artifacts": [
    {
      "architecture": "x86_64",
      "checksumUrl": "https://github.com/ranvier-labs/lean4-cuda-nightly/releases/download/nightly-2026-10-06/lean-4.33.0-cuda-nightly.20261006.ge8f10c9ff5fe-linux.tar.zst.sha256",
      "hostSystem": "Linux",
      "manifest": {
        "fileCount": 15728,
        "name": "lean-4.33.0-cuda-nightly.20261006.ge8f10c9ff5fe-linux.manifest.json",
        "schema": "lean.cuda.release-manifest/v1",
        "sha256": "744ce7cc7afff5231a95f2bcc41ef2b2bf5f0a6f5fd4722c648333ed65c69fb0",
        "size": 3154644,
        "url": "https://github.com/ranvier-labs/lean4-cuda-nightly/releases/download/nightly-2026-10-06/lean-4.33.0-cuda-nightly.20261006.ge8f10c9ff5fe-linux.manifest.json"
      },
      "name": "lean-4.33.0-cuda-nightly.20261006.ge8f10c9ff5fe-linux.tar.zst",
      "sassArchitectures": [
        "sm_90a",
        "sm_100a",
        "sm_120a"
      ],
      "sha256": "02ec960f3e1ced27e1ae3527fe1cfed9322ec546ef98a6f827cca43a677c843a",
      "size": 581700956,
      "url": "https://github.com/ranvier-labs/lean4-cuda-nightly/releases/download/nightly-2026-10-06/lean-4.33.0-cuda-nightly.20261006.ge8f10c9ff5fe-linux.tar.zst"
    },
    {
      "architecture": "aarch64",
      "checksumUrl": "https://github.com/ranvier-labs/lean4-cuda-nightly/releases/download/nightly-2026-10-06/lean-4.33.0-cuda-nightly.20261006.ge8f10c9ff5fe-linux_aarch64.tar.zst.sha256",
      "hostSystem": "Linux",
      "manifest": {
        "fileCount": 15728,
        "name": "lean-4.33.0-cuda-nightly.20261006.ge8f10c9ff5fe-linux_aarch64.manifest.json",
        "schema": "lean.cuda.release-manifest/v1",
        "sha256": "c12be3bdeabb8740cbbe393050c448a86aaad7167afbda89bcb886246558e78b",
        "size": 3154640,
        "url": "https://github.com/ranvier-labs/lean4-cuda-nightly/releases/download/nightly-2026-10-06/lean-4.33.0-cuda-nightly.20261006.ge8f10c9ff5fe-linux_aarch64.manifest.json"
      },
      "name": "lean-4.33.0-cuda-nightly.20261006.ge8f10c9ff5fe-linux_aarch64.tar.zst",
      "sassArchitectures": [
        "sm_90a",
        "sm_100a",
        "sm_121a"
      ],
      "sha256": "d254e24fd680069c2b564268a442976d6ea5f99b54a8da639e07c71e2c7ae561",
      "size": 581339537,
      "url": "https://github.com/ranvier-labs/lean4-cuda-nightly/releases/download/nightly-2026-10-06/lean-4.33.0-cuda-nightly.20261006.ge8f10c9ff5fe-linux_aarch64.tar.zst"
    }
  ],
  "build": {
    "cudaToolkitVersion": "13.0.88",
    "ptxArchitecture": "compute_90",
    "validation": {
      "extractedSmoke": true,
      "failures": 0,
      "registered": 4080,
      "skipped": 12,
      "umbrellaModules": 124
    },
    "workflowUrl": "https://github.com/ranvier-labs/lean4-cuda-backend/actions/runs/37473532314"
  },
  "channel": "nightly",
  "contentPolicy": {
    "privateLeanSources": "excluded",
    "sdkHeaders": "included"
  },
  "gates": {
    "dualArchitectureCI": "passed",
    "h100": "not-run",
    "performanceClaims": false
  },
  "id": "nightly-2026-10-06",
  "installation": {
    "elanToolchain": "ranvier-labs/lean4-cuda-nightly:nightly-2026-10-06",
    "repository": "ranvier-labs/lean4-cuda-nightly"
  },
  "limitations": [
    "Experimental nightly APIs may change incompatibly.",
    "This release carries no H100 performance claim."
  ],
  "publishedAt": "2026-10-06T18:51:53Z",
  "schema": "lean.cuda.release/v1",
  "source": {
    "commit": "e8f10c9ff5fe80018c692a47f2e0f287a74d33bf",
    "visibility": "private"
  },
  "version": "4.33.0-cuda-nightly.20261006.ge8f10c9ff5fe"
}
